<?xml version="1.0"?>
<!--
 Licensed to the Apache Software Foundation (ASF) under one
 or more contributor license agreements.  See the NOTICE file
 distributed with this work for additional information
 regarding copyright ownership.  The ASF licenses this file
 to you under the Apache License, Version 2.0 (the
 "License"); you may not use this file except in compliance
 with the License.  You may obtain a copy of the License at
 
 http://www.apache.org/licenses/LICENSE-2.0
 
 Unless required by applicable law or agreed to in writing,
 software distributed under the License is distributed on an
 "AS IS" BASIS, WITHOUT WARRANTIES OR CONDITIONS OF ANY
 KIND, either express or implied.  See the License for the
 specific language governing permissions and limitations
 under the License.   
-->


	<!-- =====================================================================
	  This XML file describes how each element in Hibernate mapping file is 
	  changed to an equivalent element in JPA Mapping file.
	 ====================================================================== -->
	 
<migration-actions xmlns:xsi="http://www.w3.org/2001/XMLSchema-instance" 
                   xsi:noNamespaceSchemaLocation='META-INF/migration-actions.xsd'>	
 
<actions for="hibernate-mapping">
	<rename-node to="entity-mappings"/>
	<promote-attr from="default-access" to="access">
		<map-value from="field"    to="FIELD"/>
		<map-value from="property" to="PROPERTY"/>
	</promote-attr>
	<ignore-attr name="auto-import"/>
	<ignore-attr name="default-lazy"/>
	<ignore-attr name="default-cascade"/>
</actions>

<!--  class is mapped to entity                                    -->
<!--  inserts a dummy node attributes                              -->
<actions for="class">
    <rename-node to="entity"/>
	<rename-attr from="name" to="class"/>
	<promote-attr from="table" to="table" as="name"/>
	<ignore-attr name="dynamic-update"/>
	<ignore-attr name="dynamic-insert"/>
	<ignore-attr name="mutable"/>
	<ignore-attr name="optimistic-lock"/>
	<ignore-attr name="polymorphism"/>
	<ignore-attr name="select-before-update"/>
	<ignore-attr name="type"/>
	<ignore-node name="cache"/>
	<insert-node name="attributes"/>
	<split-node  from="composite-id" to="id-class" on="class"/>
</actions>


<actions for="id">
    <rename-node to="id"/>
    <rename-attr from="name" to="name"/>
	<promote-attr from="column" to="column" as="name">
		<consume-attr from="length" to="length"/>
		<consume-attr from="unique" to="unique"/>
	</promote-attr>
	<ignore-attr name="type"/>
</actions>
		
<actions for="property">
	<rename-node to="basic"/>
	<rename-attr from="name" to="name"/>
	<rename-attr from="lazy" to="fetch">
		<map-value from="true"  to="LAZY"/>
		<map-value from="false" to="EAGER"/>
	</rename-attr>
	
	<rename-attr from="not-null" to="optional">
		<map-value from="true"  to="false"/>
		<map-value from="false" to="true"/>
	</rename-attr>
	<promote-attr from="column" to="column" as="name">
		<consume-attr from="length" to="length"/>
		<consume-attr from="unique" to="unique"/>
	</promote-attr>
	<ignore-attr name="type"/>
	<ignore-attr name="length"/>
	<ignore-attr name="generated"/>
	<ignore-attr name="optimistic-lock"/>
	<ignore-attr name="unique-key"/>
	
</actions>

<actions for="generator">
    <rename-node to="generated-value"/>
	<rename-attr from="class" to="strategy">
		<map-value from="native"   to="AUTO"/>
		<map-value from="assigned" to="IDENTITY"/>
	</rename-attr>
</actions>

<actions for="many-to-one">
    <rename-node to="many-to-one"/>
    <rename-attr from="name" to="name"/>
    <rename-attr from="class" to="target-entity"/>
	<rename-attr from="not-null" to="optional">
		<map-value from="true"  to="false"/>
		<map-value from="false" to="true"/>
	</rename-attr>
	<promote-attr from="column" to="join-column" as="name">
		<consume-attr from="length" to="length"/>
	</promote-attr>
	<rename-child-node from="column" to="join-column"/>
</actions>

<actions for="column">
    <rename-node to="column"/>
    <rename-attr from="name" to="name"/>
    <rename-attr from="length" to="length"/>
	<rename-attr from="not-null" to="nullable">
		<map-value from="true"  to="false"/>
		<map-value from="false" to="true"/>
	</rename-attr>
    <ignore-attr name="default"/>
    <ignore-attr name="index"/>
</actions>

<actions for="composite-id">
	<rename-node to="id"/>
	<rename-attr from="name" to="name"/>
	<ignore-attr name="class"/>
	<ignore-node name="key-property"/>
</actions>

<actions for="bag">
	<custom-node/>
</actions>
<actions for="set">
	<custom-node/>
</actions>

<actions for="cache">
</actions>
</migration-actions>	
